ID,Title,Location,Salary,Summary
3bafdba72ed14ee9,"다음 첫화면,뉴스,스포츠,연예,1boon 유저웹서비스 개발자 모집",카카오 4.0 성남 판교역,,비스 개발 1boon 서비스 개발 유저웹서비스 통합 플랫폼 구축 지원자격 기본 자격 개발 경력 2년 이상 Java 또는 Javascript 개발 역량 필수 MySQL 또는 유사한 관계형 데이터베이스 경험자 docker...
f6c6ea351bb0f996,"AI개발자, JAVA개발자, ERP컨설턴트 정규직",시너지시스템즈 서울 서초구,,"개발자, JAVA개발자, ERP컨설턴트 정규직 채용 모집부문 및 자격요건 모집부문 담당업무 자격요건 인원 1.AI개발자 2.ERP- JAVA개발자 3... 석/박사우대 [ERP JAVA개발 - 자격요건] 기술자격 : JAVA..."
d7d14d531a072930,BigDate 플래폼 S/W 엔지니어(Ingestion),에스케이플래닛 성남 분당구,,인터넷·IT·통신·모바일·게임>응용프로그래머> JAVA|인터넷·IT·통신·모바일·게임>응용프로그래머>Python|인터넷·IT·통신·모바일·게임>응용프로그래머>Linux|인터넷·IT·통신·모바일·게임>응용프로그래머>Unix
d0c8da8c7438c557,"JAVA, JSP 웹 개발자(프로그래머) 경력(5년이상↑) 정규직",나눔아이씨티 수원 영통구,,"지원자격 경력 신입·경력 학력 - 성별 무관 기타 담당업무 [직무소개] - JAVA/JSP개발 - 웹 개발자(프로그래머) - 경영정보시스템(MIS) [필요역량] - 5년이상 개발 업무 경험 - 서버,데이터베이스의 이해도..."
5e9359c4c2811720,[전액국비지원] 데이터 기반 홈IOT 서비스 개발 실무자 양성 및 취업연...,한국스마트홈산업협회 서울 금천구,,"5번 출구) 기타 유의사항 프로그래밍( Java, Wen, Python 등... 응용프로그래머> JAVA|인터넷·IT·통신·모바일·게임>응용프로그래머>Python|인터넷·IT·통신·모바일·게임>웹프로그래머> JAVA|인터넷·IT·통신..."
55d0a56acc89b674,"JAVA (고급,특급,약2년,양재부근, 제조업무 우대)",데이터윙스 서울 서초구,,부근 (신분당선) - 스킬: JAVA (제조업무 경력자 우대) - 등급... 실이 있을 경우 채용이 취소될 수 있습니다. 인터넷·IT·통신·모바일·게임>웹프로그래머> JAVA|인터넷·IT·통신·모바일·게임>응용프로그래머> JAVA
0cb282654f70db73,정산 및 재무서비스 개발자,Nexon 성남 분당구,,"출정산 및 사옥정산 시스템 개발 및 운영 - 재무관련 시스템 신규 구축 및 기존 프로젝트 유지보수 지원자격 - Java, .NET 중 하나 이상의 언어로 웹 어플리케이션 개발이 가능하신 분 - Oracle, MS-SQL..."
7538ee39e962defd,2021년 정규직 개발자,팅스나인 서울 종로구,,있습니다. 인터넷·IT·통신·모바일·게임>웹프로그래머>웹개발|인터넷·IT·통신·모바일·게임>웹프로그래머> JAVA|인터넷·IT·통신·모바일·게임>응용프로그래머>Android|인터넷·IT·통신·모바일·게임>응용프로그래머>iOS...
b1aa8525a25313d3,(주) 유니메오 함께할 (웹) 백엔드 [경력 ] 개발 인재 찾습니다.,유니메오 서울 서초구,,"[직무내용] [담당업무] - Java,Spring기반 서버개발 -개발팀 일정 및 업무관리 [자격요건] - Java,Spring기반 서버Application 개발 및 운영경험 -서버와 클라이언트 간 RESTful 기반의 개발 경험..."
5ce3dc5dd3f09dd7,"(신입,경력)JAVA/JSP/전자정부 개발자",리버스아이티 서울 영등포구,,"(주)리버스아이티(신입,경력) JAVA/JSP/전자정부 개발자 모집 모집부문 및 자격요건 담당업무 자격요건 인원 [담당업무] 1. 통합회원관리솔루션 웹기반 개발 2. 자격요건 (필수) - JAVA, JSP , SPRING..."
46975ee759c13b8a,데이터 분석/처리 플랫폼 개발,NHN 4.4 성남 판교역,,"스템을 통한 데이터 수집, 처리 및 지표 분석 경험 - 데이터 기반의 문제해결 역량 및 논리적 사고 - Java, Python, Scala 중 최소 1가지 언어를 이용한 데이터 분석 및 소프트웨어 개발 역량..."
853347a2d26d4d03,RNA Systems 웹개발자 인턴,RNAGroup 서울 종로구,,"있는 자 - 인턴십 참여에 지장이 없는 자 - HTML, JAVA, Angular 등 웹프로그래밍 경험이 있는 자 우대사항 - 자료구조 / 알고리즘 / Java 등 프로그래밍 언어 이수 - 오픈소스 소프트웨어 교내..."
643ef4db65461d01,"[(주)데이터누리] Java 개발자 신입, 경력",데이터누리 서울 강서구,,"[우대조건] - 신입 Java 개발(App 및 Web App) 가능 Web Front 개발(Javascript, Node.js, Jquery) 가능 - 경력 데이터 이행(ETL/EAI/ESB) 업무 가능자 Java 개발(App 및..."
379fcbc7c12e1d72,핀테크서비스 개발자.,제이엔커리어 서울 중구,,"공학 계열 학사이상 졸업자 - C, JAVA 가능자(핵심역량) - 경력 3... 실이 있을 경우 채용이 취소될 수 있습니다. 인터넷·IT·통신·모바일·게임>웹프로그래머> JAVA|인터넷·IT·통신·모바일·게임>응용프로그래머> JAVA"
681af0fd653ac830,[유명 신용카드사] DW 개발 및 운영 (과장급),제이앤피에이치알컨설팅 서울,,"Ecosystem의 이해 필요 - JAVA, Python 개발 경험자... 그래머>인공지능(AI)|인터넷·IT·통신·모바일·게임>응용프로그래머> JAVA|인터넷·IT·통신·모바일·게임>데이터베이스·DBA>DW|인터넷·IT·통신..."
ae1b9a320e54bc5e,"C·C++, JAVA 외 경력 정규직",데이빅스 서울 구로구,,JAVA|인터넷·IT·통신·모바일·게임>응용프로그래머>Pro-C|인터넷·IT·통신·모바일·게임>응용프로그래머>Linux|인터넷·IT·통신·모바일·게임>응용프로그래머>API|인터넷·IT·통신·모바일·게임>웹프로그래머> JAVA...
5f822035e9ddc59a,JAVA 웹 프로그램 개발자,비전브이아이텍 서울,,"[웹프로그래밍] - jsp, java, ASP / PHP 개발 능숙자... 게임>웹프로그래머>JSP|인터넷·IT·통신·모바일·게임>웹프로그래머> JAVA|인터넷·IT·통신·모바일·게임>웹프로그래머>.NET|인터넷·IT·통신..."
be95b5718905880f,AI/빅데이터/클라우드 분야 (인재 Pool),LG유플러스 3.8 서울,,"등) 능숙자 . Deep Learning Model 구현 경험자 . Java, Python등을 이용하여 분석을 위한 Data Manipulation... 활용하여 서비스 개발 경험자 2) Java,Python 등 프로그래밍 개발..."
01455f89ee27ebe4,2021년 (주)퍼브 개발 신입/경력,퍼브 서울 강서구,,인터넷·IT·통신·모바일·게임>웹프로그래머>웹개발|인터넷·IT·통신·모바일·게임>응용프로그래머> JAVA
e7c8c2b11f24fb43,Software Engineer,Google 4.3 서울,,"programming languages, including... limited to: C++, Java, C and Python. Excellent written and verbal communication..."
3648b34c0ad44f26,"[펜타시큐리티] 보안S/W 개발 및 기획자 (웹, 인증, 블록체인)",펜타시큐리티시스템 서울 영등포구,,모바일·게임>웹프로그래머> JAVA|인터넷·IT·통신·모바일·게임>웹프로그래머>Python|인터넷·IT·통신·모바일·게임>응용프로그래머>C·C++|인터넷·IT·통신·모바일·게임>응용프로그래머> JAVA|인터넷·IT·통신·모바일...
5a040eb669eb48aa,[휴먼컨설팅그룹] e-HR 시스템 구축 (Java기반) 경력직,휴먼컨설팅그룹 성남 분당구,,"그룹] e-HR 시스템 구축 ( Java기반) 경력직 ㈜휴먼컨설팅그룹(HCG... 자격요건 담당업무 자격요건 인원 [담당업무] ㆍe-HR 시스템 구축 : Java기반 웹 개발 ㆍPL, PM : e-HR 솔루션 프로젝트 사업관리 및..."
ec1c0a8aded59402,[2021] JAVA 개발 인력 (신입/경력),매트릭스투비 서울 구로구,,"무관 기타 담당업무 [2021] JAVA 개발 인력 채용 공고(신입/경력... 커리어 온라인 이력서 직무/산업 직무별(직종) 웹프로그래머웹프로그래머, JAVA 응용프로그래머Application 산업별(업종) 솔루션.ASP.소프트..."
d4c52ba1a491a8b9,현대무벡스 경력사원 상시,현대무벡스 서울 종로구,,특허|인터넷·IT·통신·모바일·게임>웹기획·웹마케팅·PM>웹기획|인터넷·IT·통신·모바일·게임>웹프로그래머> JAVA|인터넷·IT·통신·모바일·게임>웹프로그래머>Python|인터넷·IT·통신·모바일·게임>네트워크·서버·보안...
206550813b58865d,[개발자] 꿈 찾아드립니다. 저희와 함께하세요,ICON 서울 강남구,,안드로이드 개발 경력 2년 이상 - Java 혹은 kotlin 개발에 능숙... 용프로그래머>플래시APP|인터넷·IT·통신·모바일·게임>웹프로그래머> JAVA|인터넷·IT·통신·모바일·게임>웹프로그래머>Python|인터넷·IT·통신...
bde407a3d9124cc0,"[PHP, Java 외] 웹 개발자",비욘텍 인천 서구,,[직무내용] 담당업무 ㆍ[PHP JAVA] 웹 개발 지원자격 ㆍ경력 : 경력... 게임>웹프로그래머>JSP|인터넷·IT·통신·모바일·게임>응용프로그래머> JAVA|인터넷·IT·통신·모바일·게임>웹프로그래머>PHP |인터넷·IT·통신...
55a19c92c845685e,Developer / Designer recruit,마이뮤직테이스트 서울 논현동,,"i.e Python, Ruby, Java, .Net etc... testing - Test environment management - JAVA or Python - Intermediate knowledge..."
b183b99c3ff19b47,[KSTEC] 통계/Analytics 경력사원,지식시스템 성남 분당구,,"SAS, R, Python, Java 기반) 2. 기업용 데이터과학... 1. SPSS, SAS, R, Python, Java 등 데이터분석/AI개발 도구 사용 가능자 2. Java Programming 가능자 3. DB..."
e5808697206c47a3,2021 상반기 JAVA 웹 개발자,데이터로직스 서울 강남구,,인원 JAVA 웹 개발자 [자격요건] -학력 : 초대졸이상 (졸업예정자 가능) -경력 : 신입/경력 [우대조건] - 즉시 출근 가능자 - JAVA 활용... 그래머> JAVA|인터넷·IT·통신·모바일·게임>응용프로그래머> JAVA|인터...
953317384902658f,"웹개발자 (JAVA,JSP) 경력자",해내시스 서울 구로구,,"지원자격 경력 신입·경력 학력 - 성별 무관 기타 담당업무 웹 개발 ( JAVA,JSP) 스마트공장 관련 MES개발 고객사에 맞는 커스터마이징 [정보기술>정보기술개발>DB엔지니어링] 데이터베이스 구현 DBMS(Data Base..."
926706c2a928240f,ITO/IDC 시스템 운영담당자 채용,한화그룹 4.2 서울,,"운영 - Spring 기반의 Java 웹시스템 - 사업관리, 영업관리... 점외 기관 연동 개발 및 운영 - 해외주식 연동 개발 및 운영 기타 Java 기반 웹 서비스 및 미니 원장(DMA주문) 경험자 우대 [자격요건..."
fe5e79a112b1e2cc,JAVA 기반 웹개발자 정규직,에이머쉬 서울 금천구,,Nexacro 경험자 우대 에이머쉬(주) JAVA 기반 웹개발자 정규직 채용 모집부문 및 자격요건 담당업무 자격요건 인원 [담당업무] 웹개발 프로젝트... 취소될 수 있습니다. 인터넷·IT·통신·모바일·게임>웹프로그래머> JAVA
f0763e95aeadd18a,공공업무 개발구축 경력직 (JAVA 개발자),이지트론 서울 강남구,,"바랍니다. 입사지원 서류에 허위사실이 발견될 경우, 채용확정 이후라도 채용이 취소될 수 있습니다. [기타 우대내용] 유관업무 경력자 (4년) WebSquare5 유경험자 인터넷·IT·통신·모바일·게임>응용프로그래머> JAVA"
efdea0aafe0813bd,[분당] 의료IT기업 프론트엔드 개발자(5년이상),시니어앤파트너즈 성남 분당구,,"■ 우대사항 - JAVA/HTML5/Node.js 개발 경험자... MSSQL, Procedure, JAVA, 웹프로그래머 (HTML5), CSS, Node.js 우대사항: - JAVA/HTML5/Node.js 개발..."
0064deb5fa9cbce0,데이터 사이언티스트 모집,카카오 4.0 성남 판교역,,"통해 알고리즘을 개선합니다. 지원자격 지원자격 하나 이상의 프로그래밍 언어에 익숙한 분(Python, Java, C/C++, Scala 등) 머신러닝/딥러닝 오픈소스를 이용하여 1년 이상 특정 서비스에 모델 개발/운영..."
6bfec9fa5d0c15f5,1분기 개발자 (신입/경력),이스트게임즈 서울 서초구,,"Objective C, Kotlin, Java, JavaScript... 통신·모바일·게임>응용프로그래머> JAVA|인터넷·IT·통신·모바일·게임>응용프로그래머>자바스크립트|인터넷·IT·통신·모바일·게임>웹프로그래머> JAVA"
146b013aa9f65d2b,"자바스크립트, 자바스크립트 외 신입/경력 정규직",북틀 서울 마포구,,"자격요건 - 학력 : 초대졸이상 - 경력 : 1년 이상 - Javascript, JQuery 가능자 - Vue,React 등 자바스크립트 프레임웍 경험자 우대조건 - 유관업무 경험자 - 웹 개발 업무 가능자 - 자격증..."
ee3bf27b86d278c8,(주)인젠트 Java 프로그램 및 웹 프로그램 개발자,인젠트 서울 영등포구,,"(주)인젠트 JAVA프로그램 개발자 채용 모집부문 및 자격요건 담당업무 자격... JAVA 프로그램 개발자 * 웹프로그램 개발자 [우대사항] * ECM 제품 관련 숙련자 우대 * JAVA, Java Script, 정보처리기사 자격증..."
649ccf047c868778,"금융 데이터 분석 엔진, 로보어드바이저 개발자",에스비씨엔 서울 영등포구,,"개발, 분산 시스템, 머신러닝, 자연어처리. 패턴분석 - 다음 언어에서 최소 한 가지 이상 능숙자: Java, C++, Python, JavaScript 우대사항 - 석사이상 컴퓨터공학 (Computer Science..."
58ca97c3c919f00e,(주)신세계아이앤씨 서버/네트워크/보안 부문 상시,신세계아이앤씨 서울 중구,,"클라우드 서비스 플랫폼 개발 [정규직, 3년 이상] 직무 클라우드 서비스 플랫폼 개발 인원 0명 공통사항 -. Java 운영 경력 5년 이상 보유자 -. 오픈소스 개발 경험자 (Rabbit MQ Broker, RESTful..."
490021ac3aba8cfa,"JAVA, C·C++ 신입 프로그래머 (SI/SM)",이포즌 서울 성동구,,"년)졸업 이상, 공학계열 직무기술: - JAVA, C++, EAI 등 언어... 응용프로그래머>C·C++|인터넷·IT·통신·모바일·게임>응용프로그래머> JAVA|인터넷·IT·통신·모바일·게임>데이터베이스·DBA>MySQL|인터넷..."
17b8d24c72e3aec4,채널5코리아 2021년 웹개발팀 경력사원,채널5코리아 서울 구로구,,"ASP, PHP 개발운영 - MS, MySQL 구축 운영 우대사항 - JAVA 개발 경험 - Wowza 기반 개발 경험 - 영상 플랫폼 개발 경험자... 통신·모바일·게임>응용프로그래머> JAVA|인터넷·IT·통신·모바일·게임..."
adcb9af8e0b3d915,JAVA 개발자(경력직),제나 (ZENA Inc.) 서울 성동구,,(주) 제나(ZENA Inc.) JAVA 개발자(경력직) 채용 공고 모집부문 및 자격요건 담당업무 자격요건 인원 [담당업무] JAVA / JSP 개발 [근무... 통신·모바일·게임>웹프로그래머> JAVA|인터넷·IT·통신·모바일·게임...
512e5c44f34a7841,"개발자, 디자이너 신입 정규직",이노다임 서울,,Android - JAVA JSP 2. 디자이너 - 웹디자인 - 시스템디자... 게임>웹프로그래머>JSP|인터넷·IT·통신·모바일·게임>웹프로그래머> JAVA|인터넷·IT·통신·모바일·게임>웹프로그래머>MiPlatform|인터넷...
e6e3a5effcabf894,TOAST CAM 개발자,NHN 4.4 성남 판교역,,서버 개발] Job Description 자격요건 우대사항 - Java 스프링 프레임워크 기반 서버 개발 - 분산/대용량 서비스 구축/운영 - Java 개발 경력 5년 이상 - 분산/대용량 처리 기술 보유자...
ee6d176505ffa343,전장 개발 엔지니어,가오콘 서울 강서구,,"하고 있습니다. 다만 경험이 없으시더라도 C/C++고급 능력을 바탕으로 Java,Python,Json에 익숙하신 분이라면 무리없이 적응하실 수 있으니... 임베디드 C / C++ 기반 , Java/Json/Python/Xml 개발..."
8f8b4127a3e117e6,"[핀테크] C#응용 소프트웨어/ 모바일 앱 (신입,경력) 개발자",만나아이티 서울 영등포구,,게임>응용프로그래머> JAVA|인터넷·IT·통신·모바일·게임>응용프로그래머>VB.NET|인터넷·IT·통신·모바일·게임>응용프로그래머>Visual Basic|인터넷·IT·통신·모바일·게임>웹프로그래머> JAVA|인터넷·IT·통신...
20e114d0924fed03,(주)엘솔루 웹 개발자,㈜엘솔루 서울,,5 개발 가능자(필수) 1명 인터넷·IT·통신·모바일·게임>웹프로그래머> JAVA|인터넷·IT·통신·모바일·게임>웹프로그래머>.NET|인터넷·IT·통신... 통신·모바일·게임>응용프로그래머> JAVA|인터넷·IT·통신·모바일·게임...
649d56ec17a41c20,[Expert] Cloud System Engineer - Kuberne...,에스케이텔레콤 성남 분당구,,3. 7 인터넷·IT·통신·모바일·게임>응용프로그래머> JAVA|인터넷·IT·통신·모바일·게임>응용프로그래머>C·C++|인터넷·IT·통신·모바일·게임>응용프로그래머>클라우드|인터넷·IT·통신·모바일·게임>웹프로그래머> JAVA
11f4e5048af50bfe,"JAVA, C언어, 암호화모듈 솔루션 개 개발자 신입 및 경력",이지서티 서울 구로구,,"(주)이지서티 JAVA, C언어, 암호화모듈 솔루션 개발자 신입 및 경력직 채용공고 모집부문 및 자격요건 담당업무 자격요건 인원 [담당업무] 제품개발, 솔루션 개발(C, JAVA) [근무부서 및 직급/직책] 근무부서: 제품개발..."
8b7782bb4ac157d4,"Java, JSP/eGovframe/웹개발 외 경력 정규직 개발자",엠브이소프텍 대전 서구,,"(주)엠브이소프텍 Java, JSP/eGovframe/웹개발 외 경력 정규직... 통신·모바일·게임>웹프로그래머>JSP|인터넷·IT·통신·모바일·게임>웹프로그래머> JAVA|인터넷·IT·통신·모바일·게임>웹프로그래머>.NET"
a38d00971a5a50e8,카카오톡 안드로이드 클라이언트 개발자 모집,카카오 4.0 성남 판교역,,"라이언트 안드로이드 버전 개발 지원자격 ✔ 안드로이드 클라이언트 개발 #필요 기술셋 및 지원 자격 Java, Kotlin 신입 및 경력연차 무관 #우대사항 최신개발 동향에 관심이 많은 분 목표지향적인 사고와 실행..."
4a77a9e0b52bc188,웹개발자 (신입 및 경력) / 보안솔루션 개발팀,유비엔티스랩 서울 구로구,,게임>웹프로그래머>JSP|인터넷·IT·통신·모바일·게임>응용프로그래머> JAVA|인터넷·IT·통신·모바일·게임>웹프로그래머>PHP |인터넷·IT·통신... 통신·모바일·게임>웹프로그래머> JAVA|인터넷·IT·통신·모바일·게임>웹프...
1f038de78a21b10b,Technical Customer Service Associate,Amazon Web Services Korea LLC 서울,,friends and family? Does the idea of launching a load balanced java application in Singapore from your laptop in Seattle make...
89974e68032c906c,JAVA 제철소업무 개발 및 MES3.0 확대개발-판교,연우정보기술 성남 분당구,,JAVA 개발 능숙자 - MES 및 제철소업무 개발경력자 - 판교 근무가능자 연우정보기술(주) JAVA 제철소업무 및 MES확대개발-판교 모집부문 및 자격요건 담당업무 자격요건 인원 [담당업무] [웹프로그래밍] JAVA 제철...
2120aee1f798ec41,"웹개발, 운영 신입/경력직",파인랩 서울 강남구,,"2년 이상) 학력사항: 대학졸업 이상 직무기술: 웹개발 [필수 조건] - JAVA, JSP - Oracle [우대 사항] 보험 및 금융 웹 관련 운영... 웹프로그래머>JSP|인터넷·IT·통신·모바일·게임>웹프로그래머> JAVA"
d3081baa25319242,2021년 상반기 (주)인사이트컨설팅 미국 입시 담당자(아카데믹 카운슬러...,인사이트컨설팅 서울 강남구,,"관련 프로젝트 경험자 - 사업기획서 작성 가능자 - 제안서 작성 능숙자 [응용 프로그래밍] - C, C++, JAVA, 임베디드 개발 유경험자 - .NET 프레임워크에 대한 기반 지식 보유자 - 네트워크 프로그래밍에 대한..."
473f19e484779599,국내카드사 DW개발,제이엔커리어 서울 서초구,,"Ecosystem의 이해 필요 - JAVA, Python 개발 경험자... 인터넷·IT·통신·모바일·게임>웹프로그래머> JAVA|인터넷·IT·통신·모바일·게임>응용프로그래머> JAVA|인터넷·IT·통신·모바일·게임>데이터베이스..."
d3ce86451b9469f9,KB저축은행 IT부문 경력직 (정규직) 수시,KB저축은행 서울 송파구,,관련학과 졸업자 또는 동등학력 이상 소지자 ㆍ성별 : 무관 ㆍ경력 : 금융기관 업무 개발 경력 2년 이상 JAVA 및 C언어 개발 가능한 자 [우대요건] ㆍ금융 및 IT관련 자격증 보유 / 대용량 데이터 처리 개발(오라클DB...
d1de3c6292d51a81,"JAVA, C·C++ 신입,경력 프로그래머 (SM)",이포즌 서울 성동구,,"UDP 및 OSI 7 Layer 등) 지식보유 - 프로그램 개발 경험( JAVA, C#, C++) - DBMS 사용경험(Oracle, MS-SQL 등... 통신·모바일·게임>응용프로그래머> JAVA|인터넷·IT·통신·모바일·게임..."
f8f5b678c5564e1e,"웹개발, JAVA 신입/경력 정규직",피디시스템 서울 금천구,,"피디시스템 웹개발, JAVA 신입/경력 정규직 채용 모집부문 및 자격요건 담당업무 자격요건 인원 [담당업무] 웹개발 / java 프로그래머 [근무부서... 웹프로그래머>웹개발|인터넷·IT·통신·모바일·게임>응용프로그래머> JAVA"
029f506075040a92,국내캐피탈사 IT개발(과장급).,제이엔커리어 서울 강남구,,"시스템 운영 및 개발 경험자 - JAVA, Spring구조 개발 경험자(3... 실이 있을 경우 채용이 취소될 수 있습니다. 인터넷·IT·통신·모바일·게임>웹프로그래머> JAVA|인터넷·IT·통신·모바일·게임>응용프로그래머> JAVA"
ac7cb0765d47478c,SK플래닛 각 부문별 경력사원,에스케이플래닛 성남 분당구,,Responsibilities 플랫폼 개발 및 운영 Requirement Java & Spring Framework 기반 서버 개발 경험 (3년 이상... 백엔드 서버 개발 5년 이상 Java 및 Spring Framework...
177314202292c97c,"JAVA, JSP 신입/경력 정규직",넥스트아이씨티 서울 구로구,,"(주)넥스트아이씨티 JAVA, JSP 신입/경력 정규직 채용 모집부문 및 자격요건 담당업무 자격요건 인원 [담당업무] JAVA/ JSP, 웹프로그래밍... 통신·모바일·게임>웹프로그래머> JAVA|인터넷·IT·통신·모바일·게임>웹프..."
37808d2628544b92,[TmaxGroup/R&D] R&D 개발 연구원 신입/경력 (병역특례포함...,티맥스소프트 성남 분당구,,"이상 / 기졸업자 또는 21년 8월 졸업 예정자 컴퓨터 및 전산관련 전공자, 전자공학 전공자 우대 C 또는 JAVA 프로그래밍 유경험자 ※ 전문연구요원 희망자는 석사 이상 학위 소지자만 가능 (현 전문연구요원 근무자..."
6405284789811205,ITKey 아이티키 JAVA 신입 개발자,아이티키 서울 금천구,,담당업무 ITKey (주)아이티키 JAVA 신입 개발자 채용 커리어 양식... 하기 지원양식 커리어 온라인 이력서 직무/산업 직무별(직종) 웹프로그래머 JAVA 응용프로그래머전산전공 산업별(업종) 솔루션.ASP.소프트웨어 소프트웨어개발
2c56cc62c7933521,인터넷/모바일 뱅킹 부문 계약직(전문직),한국씨티은행 4.2 서울 영등포구,,웹 개발 경험 - JAVA JQuery / Java / Oracle 사용... 응용프로그래머> JAVA|인터넷·IT·통신·모바일·게임>응용프로그래머>Linux|인터넷·IT·통신·모바일·게임>웹프로그래머> JAVA|인터넷·IT·통신...
144abbe0e251650c,[유안타증권]IT부문 신입/경력 직원,유안타증권 서울 중구 +1 지역,,"해당분야 대리/과장급 경력자(경력 3년 이상) · 파생상품 업무 이해 능력을 보유한 자 · Pro*c, java, jsp, PL/SQL 사용 능력을 보유한 자 · CFD(차액결제 시스템) 유경험자 우대 · IT관련 전공자 및..."
5702d33f9f06f8da,[(주) 모베이스] 모베이스와 함께할 성실한 자바(Java) 개발자,모베이스 서울 마포구,,"[응용 프로그래밍] - C, C++, JAVA, 임베디드 개발 유경험자 - .NET... 대한 이해도가 높은 분 - 제택근무 가능 - JAVA, JSP, Angularjs 개발 가능자 인터넷·IT·통신·모바일·게임>응용프로그래머> JAVA"
5f492fde9816d7d7,TV 사업부 분야별 경력사원,LG디스플레이 3.4 서울 여의도역,,"Binary 관리 필수 조건 : 경력 5년 이상 1) 안드로이드 스튜디오 관련 앱 개발 2) HTML, CSS, Java, C,C++ 언어 경험 . 담당 업무 1) OLED TV 보상 및 구동 알고리즘 개발 2) 잔상 보상..."
2743535f3f3e3eef,(주)엠앤와이즈 JAVA/웹 개발자 (신입/경력),엠앤와이즈 서울 구로구,,"- 정보처리(산업)기사 - JAVA/웹/Spring framework 유경험자... 호회 운영, 야간교통비지급, 연차, 여름휴가 등 인터넷·IT·통신·모바일·게임>웹프로그래머> JAVA|인터넷·IT·통신·모바일·게임>웹프로그래머>웹개발"
b5be4d1a74802227,구로디지털단지 중소기업 정규직 JAVA JSP 경력직원,커리어웍스 서울,,"[구디/정규직] JAVA/JSP 소프트웨어개발 ㈜당사는 국내자동차 완성차... 인원 수입차 브랜드 딜러에서 사용하는 웹기반 시스템 개발 및 유지보수 JAVA/JSP 언어 사용, SQL, spring framework/iBatis..."
01455f89ee27ebe4,2021년 (주)퍼브 개발 신입/경력,퍼브 서울 강서구,,인터넷·IT·통신·모바일·게임>웹프로그래머>웹개발|인터넷·IT·통신·모바일·게임>응용프로그래머> JAVA
a8de67022a7e45f2,자산·디지털 부문 경력사원 채용,삼성생명 4.1 서울 서초동,,"서비스 개발 및 프로세스 경험 4년↑ -Spring Framework기반 Java개발 실무 경험 4년↑ · Spring/Vue Framework Java script, Oracle 等 -Front Framework(Vue..."
